{
  "contract_version": "1.0",
  "agent": "code-smell-detector",
  "kind": "audit",
  "status": "complete",
  "reasoning": "formatCurrency em src/utils/formatCurrency.ts tem 6 linhas, responsabilidade unica e delega formatacao ao Intl.NumberFormat nativo. Nenhum Magic Number, nenhuma Feature Envy, nenhuma duplicacao detectada no trecho auditado. Funcao esta dentro do limite de 20 linhas e nao apresenta cheiro de refatoracao imediata.",
  "payload": {
    "domain_status": "clean",
    "issues": []
  },
  "metadata": { "run_id": "test-code-smell-detector-001", "duration_ms": 0, "model": "test" }
}
