{
  "contract_version": "1.0",
  "agent": "documentation-writer",
  "kind": "mutation",
  "status": "complete",
  "reasoning": "Adicionei step 'iterate' apos 'verify-work' em PIPELINE.md (diagrama ASCII + tabela de descricao). Tambem notei que MODEL_PROFILES.md menciona 'balanced' como default mas SKILL.md do iterate ja usa 'quality' — inconsistencia fora do escopo desta operacao, mas vale alinhar em follow-up separado.",
  "payload": {
    "mutation": "step 'iterate' added after 'verify-work' in docs/PIPELINE.md (diagram + table)"
  },
  "metadata": { "run_id": "test-documentation-writer-001", "duration_ms": 0, "model": "test" }
}
