{
  "contract_version": "1.0",
  "agent": "tdd-verifier",
  "kind": "audit",
  "status": "complete",
  "reasoning": "PaymentService tem 3 metodos publicos mas apenas charge esta coberto. refund e getHistory estao sem teste — 67% dos metodos descobertos. O mock em charge usa jest.fn() para todos os 3 argumentos do construtor com a mesma funcao, sugerindo que o autor nao conhece a assinatura real das dependencias. Compliance TDD e parcial, nao suficiente para merge.",
  "payload": {
    "domain_status": "issues_found",
    "issues": [
      {
        "severity": "high",
        "file": "src/services/PaymentService.test.ts",
        "line": 1,
        "description": "refund e getHistory sem cobertura de teste — 2 de 3 metodos publicos descobertos; adicionar casos de teste antes de merge"
      },
      {
        "severity": "medium",
        "file": "src/services/PaymentService.test.ts",
        "line": 3,
        "description": "Mock excessivo: mesmo jest.fn() passado para todos os argumentos do construtor — mock nao reflete contratos reais das dependencias, teste pode passar com implementacao incorreta"
      }
    ]
  },
  "metadata": { "run_id": "test-tdd-verifier-001", "duration_ms": 0, "model": "test" }
}
