{
  "contract_version": "1.0",
  "agent": "lesson-evaluator",
  "kind": "audit",
  "status": "complete",
  "reasoning": "Licao tem 3 ocorrencias documentadas com evidencia concreta (reasoning identico cross-agente, threshold de warning, repeticao de fixture) e prescricao acionavel ja implementada no parser (REASONING_LIKELY_WEAK). Nao e redundante com lesson-2026-04-12 que cobre formatacao de prompt, nao qualidade de reasoning. Vale capturar como compound duravel.",
  "payload": {
    "domain_status": "clean",
    "issues": []
  },
  "metadata": { "run_id": "test-lesson-evaluator-001", "duration_ms": 0, "model": "test" }
}
