{
  "contract_version": "1.0",
  "agent": "infrastructure-auditor",
  "kind": "audit",
  "status": "complete",
  "reasoning": "Deployment api-service tem liveness e readiness probes configurados em endpoints distintos (/health e /ready) com initialDelaySeconds adequados, e pod anti-affinity obrigatorio por hostname garantindo distribuicao das 3 replicas em nos distintos. Configuracao de disponibilidade esta correta para producao. Resource limits ausentes mas fora do escopo declarado desta auditoria.",
  "payload": {
    "domain_status": "clean",
    "issues": []
  },
  "metadata": { "run_id": "test-infrastructure-auditor-001", "duration_ms": 0, "model": "test" }
}
