{
  "contract_version": "1.0",
  "agent": "security-auditor",
  "kind": "audit",
  "status": "complete",
  "reasoning": "texto suficientemente longo aqui para passar o threshold ok",
  "payload": {
    "issues": [
      {
        "severity": "high",
        "description": "API_KEY=abc123def456ghi789 found in source"
      }
    ]
  }
}
