{
  "contract_version": "1.0",
  "agent": "react-auditor",
  "kind": "audit",
  "status": "complete",
  "reasoning": "useEffect em UserProfile.tsx:7 nao inclui userId na dependency array — stale closure garante que o fetch ignora mudancas subsequentes de prop. Padrao claro de data-fetching em useEffect que deve migrar para React Query ou useSWR conforme regra do projeto.",
  "payload": {
    "domain_status": "issues_found",
    "issues": [
      {
        "severity": "high",
        "file": "src/components/UserProfile.tsx",
        "line": 7,
        "description": "useEffect com dependency array vazio mas usa prop userId — stale closure; adicionar userId como dependencia ou migrar para React Query"
      },
      {
        "severity": "medium",
        "file": "src/components/UserProfile.tsx",
        "line": 8,
        "description": "fetchUser chamado em useEffect — anti-pattern do projeto; substituir por useSWR/TanStack Query para cache e retry automaticos"
      }
    ]
  },
  "metadata": { "run_id": "test-react-auditor-001", "duration_ms": 0, "model": "test" }
}
